{"$schema":"https://json-schema.org/draft/2020-12/schema","type":"object","additionalProperties":false,"required":["task_id","conclusion","result","claimed_assurance","scope","completeness","evidence","limitations"],"properties":{"task_id":{"const":"jacobian/trigonometric-power-sum-valuation"},"conclusion":{"enum":["DIVISIBILITY_CERTIFIED","INSUFFICIENT_EVIDENCE"]},"result":{"type":"object","additionalProperties":false,"required":["minimal_polynomial_descending","initial_power_sums","recurrence_coefficients","terms","induction_cases","conclusion"],"properties":{"minimal_polynomial_descending":{"const":[1,-7,14,-7]},"initial_power_sums":{"const":[3,7,21]},"recurrence_coefficients":{"const":[7,-14,7]},"terms":{"type":"array","minItems":25,"maxItems":25,"items":{"type":"object","additionalProperties":false,"required":["n","value","seven_adic_valuation","required_valuation"],"properties":{"n":{"type":"integer","minimum":0,"maximum":24},"value":{"type":"integer"},"seven_adic_valuation":{"type":"integer","minimum":0},"required_valuation":{"type":"integer","minimum":0}}}},"induction_cases":{"type":"array","minItems":3,"maxItems":3,"items":{"type":"object","additionalProperties":false,"required":["residue","coefficient_adjusted_offsets"],"properties":{"residue":{"type":"integer","minimum":0,"maximum":2},"coefficient_adjusted_offsets":{"type":"array","minItems":3,"maxItems":3,"items":{"type":"integer","minimum":0}}}}},"conclusion":{"const":"DIVISIBLE_FOR_ALL_POSITIVE_N"}}},"claimed_assurance":{"enum":["UNVERIFIED","COMPUTED","CHECKED","VERIFIED"]},"scope":{"type":"string"},"completeness":{"enum":["COMPLETE","PARTIAL","UNKNOWN"]},"evidence":{"type":"array","minItems":1,"maxItems":1,"items":{"type":"object","additionalProperties":false,"required":["path","sha256"],"properties":{"path":{"const":"evidence/answer.txt"},"sha256":{"type":"string","pattern":"^sha256:[0-9a-f]{64}$"}}}},"limitations":{"type":"array","minItems":1,"items":{"type":"string"}}}}
