{"task_id":"jacobian/trigonometric-power-sum-valuation","conclusion":"DIVISIBILITY_CERTIFIED","result":{"minimal_polynomial_descending":[1,-7,14,-7],"initial_power_sums":[3,7,21],"recurrence_coefficients":[7,-14,7],"terms":[{"n":0,"value":3,"seven_adic_valuation":0,"required_valuation":0},{"n":1,"value":7,"seven_adic_valuation":1,"required_valuation":0},{"n":2,"value":21,"seven_adic_valuation":1,"required_valuation":0},{"n":3,"value":70,"seven_adic_valuation":1,"required_valuation":1},{"n":4,"value":245,"seven_adic_valuation":2,"required_valuation":1},{"n":5,"value":882,"seven_adic_valuation":2,"required_valuation":1},{"n":6,"value":3234,"seven_adic_valuation":2,"required_valuation":2},{"n":7,"value":12005,"seven_adic_valuation":4,"required_valuation":2},{"n":8,"value":44933,"seven_adic_valuation":3,"required_valuation":2},{"n":9,"value":169099,"seven_adic_valuation":3,"required_valuation":3},{"n":10,"value":638666,"seven_adic_valuation":5,"required_valuation":3},{"n":11,"value":2417807,"seven_adic_valuation":4,"required_valuation":3},{"n":12,"value":9167018,"seven_adic_valuation":4,"required_valuation":4},{"n":13,"value":34790490,"seven_adic_valuation":5,"required_valuation":4},{"n":14,"value":132119827,"seven_adic_valuation":6,"required_valuation":4},{"n":15,"value":501941055,"seven_adic_valuation":5,"required_valuation":5},{"n":16,"value":1907443237,"seven_adic_valuation":6,"required_valuation":5},{"n":17,"value":7249766678,"seven_adic_valuation":6,"required_valuation":5},{"n":18,"value":27557748813,"seven_adic_valuation":6,"required_valuation":6},{"n":19,"value":104759610858,"seven_adic_valuation":7,"required_valuation":6},{"n":20,"value":398257159370,"seven_adic_valuation":7,"required_valuation":6},{"n":21,"value":1514069805269,"seven_adic_valuation":7,"required_valuation":7},{"n":22,"value":5756205681709,"seven_adic_valuation":8,"required_valuation":7},{"n":23,"value":21884262613787,"seven_adic_valuation":8,"required_valuation":7},{"n":24,"value":83201447389466,"seven_adic_valuation":8,"required_valuation":8}],"induction_cases":[{"residue":0,"coefficient_adjusted_offsets":[0,0,0]},{"residue":1,"coefficient_adjusted_offsets":[1,0,0]},{"residue":2,"coefficient_adjusted_offsets":[1,1,0]}],"conclusion":"DIVISIBLE_FOR_ALL_POSITIVE_N"},"claimed_assurance":"COMPUTED","scope":"the frozen cubic recurrence and residue-class 7-adic induction","completeness":"COMPLETE","evidence":[{"path":"evidence/answer.txt","sha256":"sha256:ac131c08de68d324cf97364305b99d779863a634f06a6be938dd9ec24b27ef75"}],"limitations":["The checker does not independently verify the trigonometric-to-cubic derivation."]}
